{
  "id": "L",
  "title": "Bent wing",
  "kind": "arch.wing",
  "tags": ["branching"],
  "footprint": { "halfX": 12, "zMin": -8, "zMax": 4, "height": 3.4 },
  "sockets": [
    { "id": "entry", "role": "entry", "wall": "south", "u": 0 },
    { "id": "exit-a", "role": "exit", "wall": "north", "u": 0 },
    { "id": "exit-b", "role": "exit", "wall": "east", "u": 1.2 },
    { "id": "exit-c", "role": "exit", "wall": "west", "u": -2 }
  ],
  "regions": {
    "entry-left": [-2.4, 0, 2],
    "center": [0, 0, -2],
    "hearth-wall": [7.5, 0, 1.4],
    "far-corner": [-2.8, 0, -6.4]
  }
}
