{
  "id": "shaft",
  "title": "Well",
  "kind": "arch.shaft",
  "tags": ["vertical", "tight"],
  "footprint": { "halfX": 5, "zMin": -5, "zMax": 5, "height": 10 },
  "sockets": [
    { "id": "entry", "role": "entry", "wall": "south", "u": 0 },
    { "id": "exit-a", "role": "exit", "wall": "north", "u": 0 },
    { "id": "exit-b", "role": "exit", "wall": "west", "u": 0.6 },
    { "id": "exit-c", "role": "exit", "wall": "east", "u": 0.6 }
  ],
  "regions": {
    "entry-left": [-3, 0, 2.6],
    "center": [0, 0, 0],
    "hearth-wall": [3, 0, 2.4],
    "far-corner": [-2.8, 0, -3]
  }
}
