{
  "id": "U",
  "title": "Horseshoe",
  "kind": "arch.chamber",
  "tags": ["branching"],
  "footprint": { "halfX": 9, "zMin": -7, "zMax": 5, "height": 3.6 },
  "sockets": [
    { "id": "entry", "role": "entry", "wall": "south", "u": -4 },
    { "id": "exit-a", "role": "exit", "wall": "north", "u": 0 },
    { "id": "exit-b", "role": "exit", "wall": "south", "u": 4 },
    { "id": "exit-c", "role": "exit", "wall": "west", "u": -2 }
  ],
  "regions": {
    "entry-left": [-6, 0, 3],
    "center": [0, 0, -1],
    "hearth-wall": [6, 0, 2.6],
    "far-corner": [5.5, 0, -5]
  }
}
