{
  "id": "I",
  "title": "Straight hall",
  "kind": "arch.corridor",
  "tags": ["tight"],
  "footprint": { "halfX": 8, "zMin": -6.2, "zMax": 5.2, "height": 3.2 },
  "sockets": [
    { "id": "entry", "role": "entry", "wall": "south", "u": 0, "y": 1, "position": [0, 1, 0], "yaw": 3.141592653589793 },
    { "id": "exit-a", "role": "exit", "wall": "north", "u": 0 },
    { "id": "exit-b", "role": "exit", "wall": "west", "u": 1.2 },
    { "id": "exit-c", "role": "exit", "wall": "east", "u": 1.2 },
    { "id": "exit-d", "role": "exit", "wall": "east", "u": -3.2 }
  ],
  "regions": {
    "entry-left": [-5, 0, 2.4],
    "center": [0, 0, -0.5],
    "hearth-wall": [5, 0, 2.2],
    "far-corner": [-5.4, 0, -3.6]
  }
}
